[
  {
    "id": "REL-0001",
    "source_id": "GO2026-001",
    "target_id": "GO2026-002",
    "relationship_type": "related-to",
    "description": "Initiative plan references waste management guidelines",
    "created_at": "2026-07-06T15:38:05.772Z"
  },
  {
    "id": "REL-0002",
    "source_id": "GO2026-001",
    "target_id": "GO2026-003",
    "relationship_type": "related-to",
    "description": "Initiative plan referenced in quarterly report",
    "created_at": "2026-07-06T15:38:05.772Z"
  },
  {
    "id": "REL-0003",
    "source_id": "GO2026-001",
    "target_id": "GO2026-004",
    "relationship_type": "derived-from",
    "description": "Energy plan derived from initiative strategy",
    "created_at": "2026-07-06T15:38:05.772Z"
  },
  {
    "id": "REL-0004",
    "source_id": "GO2026-001",
    "target_id": "GO2026-005",
    "relationship_type": "derived-from",
    "description": "Water plan derived from initiative strategy",
    "created_at": "2026-07-06T15:38:05.772Z"
  },
  {
    "id": "REL-0005",
    "source_id": "GO2026-001",
    "target_id": "GO2026-006",
    "relationship_type": "related-to",
    "description": "Green procurement aligns with initiative goals",
    "created_at": "2026-07-06T15:38:05.772Z"
  },
  {
    "id": "REL-0006",
    "source_id": "GO2026-001",
    "target_id": "GO2026-007",
    "relationship_type": "related-to",
    "description": "Training supports initiative implementation",
    "created_at": "2026-07-06T15:38:05.772Z"
  },
  {
    "id": "REL-0007",
    "source_id": "GO2026-003",
    "target_id": "GO2026-008",
    "relationship_type": "superseded-by",
    "description": "Q2 report contains more recent data than Q1",
    "created_at": "2026-07-06T15:38:05.772Z"
  },
  {
    "id": "REL-0008",
    "source_id": "GO2026-004",
    "target_id": "SC-005",
    "relationship_type": "references",
    "description": "Energy monitoring data from smart campus",
    "created_at": "2026-07-06T15:38:05.772Z"
  },
  {
    "id": "REL-0009",
    "source_id": "GO2026-006",
    "target_id": "ESD-002",
    "relationship_type": "references",
    "description": "Aligns with university procurement guidelines",
    "created_at": "2026-07-06T15:38:05.772Z"
  },
  {
    "id": "REL-0010",
    "source_id": "GO2026-007",
    "target_id": "LC-003",
    "relationship_type": "related-to",
    "description": "Sustainability training complements digital literacy",
    "created_at": "2026-07-06T15:38:05.772Z"
  },
  {
    "id": "REL-0011",
    "source_id": "GO2026-009",
    "target_id": "SC-005",
    "relationship_type": "references",
    "description": "Energy data shared with smart campus monitoring",
    "created_at": "2026-07-06T15:38:05.772Z"
  },
  {
    "id": "REL-0012",
    "source_id": "GO2026-010",
    "target_id": "CE-004",
    "relationship_type": "related-to",
    "description": "Joint newsletter content sharing across projects",
    "created_at": "2026-07-06T15:38:05.772Z"
  },
  {
    "id": "REL-0013",
    "source_id": "RAE-001",
    "target_id": "RAE-002",
    "relationship_type": "related-to",
    "description": "Guide references evidence submission template",
    "created_at": "2026-07-06T15:38:05.772Z"
  },
  {
    "id": "REL-0014",
    "source_id": "RAE-001",
    "target_id": "RAE-003",
    "relationship_type": "related-to",
    "description": "Assessment guide informs annual RAE reporting",
    "created_at": "2026-07-06T15:38:05.772Z"
  },
  {
    "id": "REL-0015",
    "source_id": "RAE-001",
    "target_id": "RAE-004",
    "relationship_type": "related-to",
    "description": "Guide references research classification standards",
    "created_at": "2026-07-06T15:38:05.772Z"
  },
  {
    "id": "REL-0016",
    "source_id": "RAE-001",
    "target_id": "RAE-005",
    "relationship_type": "references",
    "description": "Guide instructs use of faculty profile template",
    "created_at": "2026-07-06T15:38:05.772Z"
  },
  {
    "id": "REL-0017",
    "source_id": "RAE-001",
    "target_id": "RAE-006",
    "relationship_type": "references",
    "description": "Guide based on published RAE criteria standards",
    "created_at": "2026-07-06T15:38:05.772Z"
  },
  {
    "id": "REL-0018",
    "source_id": "RAE-001",
    "target_id": "RAE-007",
    "relationship_type": "related-to",
    "description": "Guide referenced in evidence review checklist",
    "created_at": "2026-07-06T15:38:05.772Z"
  },
  {
    "id": "REL-0019",
    "source_id": "RAE-001",
    "target_id": "RAE-008",
    "relationship_type": "related-to",
    "description": "Guide discussed in steering committee meeting",
    "created_at": "2026-07-06T15:38:05.772Z"
  },
  {
    "id": "REL-0020",
    "source_id": "RAE-002",
    "target_id": "RAE-005",
    "relationship_type": "related-to",
    "description": "Both are standardized RAE templates",
    "created_at": "2026-07-06T15:38:05.772Z"
  },
  {
    "id": "REL-0021",
    "source_id": "RAE-002",
    "target_id": "RAE-007",
    "relationship_type": "related-to",
    "description": "Submission template linked to review checklist",
    "created_at": "2026-07-06T15:38:05.772Z"
  },
  {
    "id": "REL-0022",
    "source_id": "RAE-003",
    "target_id": "RAE-008",
    "relationship_type": "related-to",
    "description": "Annual report informed by committee meetings",
    "created_at": "2026-07-06T15:38:05.772Z"
  },
  {
    "id": "REL-0023",
    "source_id": "RAE-003",
    "target_id": "AQ-002",
    "relationship_type": "related-to",
    "description": "RAE report aligns with QA self-assessment data",
    "created_at": "2026-07-06T15:38:05.772Z"
  },
  {
    "id": "REL-0024",
    "source_id": "RAE-004",
    "target_id": "RAE-006",
    "relationship_type": "references",
    "description": "Classification standards based on RAE criteria",
    "created_at": "2026-07-06T15:38:05.772Z"
  },
  {
    "id": "REL-0025",
    "source_id": "RAE-006",
    "target_id": "AQ-001",
    "relationship_type": "references",
    "description": "RAE criteria align with IQA manual standards",
    "created_at": "2026-07-06T15:38:05.772Z"
  },
  {
    "id": "REL-0026",
    "source_id": "LC-001",
    "target_id": "LC-002",
    "relationship_type": "related-to",
    "description": "Catalog data informs annual report enrollment statistics",
    "created_at": "2026-07-06T15:38:05.772Z"
  },
  {
    "id": "REL-0027",
    "source_id": "LC-001",
    "target_id": "LC-003",
    "relationship_type": "related-to",
    "description": "Digital literacy workshop listed in course catalog",
    "created_at": "2026-07-06T15:38:05.772Z"
  },
  {
    "id": "REL-0028",
    "source_id": "LC-001",
    "target_id": "LC-004",
    "relationship_type": "related-to",
    "description": "Writing skills course offered through catalog",
    "created_at": "2026-07-06T15:38:05.772Z"
  },
  {
    "id": "REL-0029",
    "source_id": "LC-001",
    "target_id": "LC-005",
    "relationship_type": "related-to",
    "description": "Catalog participation data in Q1 activity report",
    "created_at": "2026-07-06T15:38:05.772Z"
  },
  {
    "id": "REL-0030",
    "source_id": "LC-001",
    "target_id": "LC-006",
    "relationship_type": "related-to",
    "description": "Online platform user guide helps access catalog courses",
    "created_at": "2026-07-06T15:38:05.772Z"
  },
  {
    "id": "REL-0031",
    "source_id": "LC-001",
    "target_id": "LC-007",
    "relationship_type": "references",
    "description": "Registration template used for catalog course enrollment",
    "created_at": "2026-07-06T15:38:05.772Z"
  },
  {
    "id": "REL-0032",
    "source_id": "LC-001",
    "target_id": "LC-008",
    "relationship_type": "related-to",
    "description": "Catalog expansion part of strategic plan",
    "created_at": "2026-07-06T15:38:05.772Z"
  },
  {
    "id": "REL-0033",
    "source_id": "LC-003",
    "target_id": "LC-004",
    "relationship_type": "related-to",
    "description": "Digital literacy and academic writing programs complement",
    "created_at": "2026-07-06T15:38:05.772Z"
  },
  {
    "id": "REL-0034",
    "source_id": "LC-003",
    "target_id": "SD-002",
    "relationship_type": "related-to",
    "description": "Digital literacy skills support career preparation",
    "created_at": "2026-07-06T15:38:05.772Z"
  },
  {
    "id": "REL-0035",
    "source_id": "LC-004",
    "target_id": "RP-002",
    "relationship_type": "references",
    "description": "Writing handbook references research methodology guidelines",
    "created_at": "2026-07-06T15:38:05.772Z"
  },
  {
    "id": "REL-0036",
    "source_id": "LC-006",
    "target_id": "DT-003",
    "relationship_type": "related-to",
    "description": "Online learning platform part of digital transformation",
    "created_at": "2026-07-06T15:38:05.772Z"
  },
  {
    "id": "REL-0037",
    "source_id": "LC-007",
    "target_id": "LC-001",
    "relationship_type": "references",
    "description": "Registration form used for catalog course enrollment",
    "created_at": "2026-07-06T15:38:05.772Z"
  },
  {
    "id": "REL-0038",
    "source_id": "LC-008",
    "target_id": "LC-002",
    "relationship_type": "related-to",
    "description": "Strategic plan defines targets for annual performance",
    "created_at": "2026-07-06T15:38:05.772Z"
  },
  {
    "id": "REL-0039",
    "source_id": "LC-005",
    "target_id": "LC-002",
    "relationship_type": "related-to",
    "description": "Q1 contributes to annual performance metrics",
    "created_at": "2026-07-06T15:38:05.772Z"
  },
  {
    "id": "REL-0040",
    "source_id": "RP-001",
    "target_id": "RP-002",
    "relationship_type": "related-to",
    "description": "Database schema supports methodology documentation",
    "created_at": "2026-07-06T15:38:05.772Z"
  },
  {
    "id": "REL-0041",
    "source_id": "RP-001",
    "target_id": "RP-003",
    "relationship_type": "related-to",
    "description": "Database stores publication records and metadata",
    "created_at": "2026-07-06T15:38:05.772Z"
  },
  {
    "id": "REL-0042",
    "source_id": "RP-001",